{
  "$schema": "https://linkz.fishball.app/config-schema.json",
  "outDir": "dist",
  "publicDir": "public",
  "favicon": "logo.png",
  "profilePicture": "logo.png",
  "name": "Linkz",
  "links": [
    {
      "title": "Github",
      "url": "https://github.com/fishballapp/linkz"
    },
    {
      "title": "JSR",
      "url": "https://jsr.io/@fishballpkg/linkz"
    }
  ]
}
